{
  "$schema": "https://json-schema.org/draft/2020-12/schema",
  "title": "Before You Buy V0 input",
  "type": "object",
  "properties": {
    "schema_version": {
      "const": "0.1"
    },
    "case_id": {
      "type": "string",
      "minLength": 1,
      "maxLength": 128,
      "pattern": "^[A-Za-z0-9][A-Za-z0-9_.:/-]*$"
    },
    "revision": {
      "type": "string",
      "minLength": 1,
      "maxLength": 128,
      "pattern": "^[A-Za-z0-9][A-Za-z0-9_.:/-]*$"
    },
    "room": {
      "type": "object",
      "properties": {
        "identity": {
          "type": "string",
          "minLength": 1,
          "maxLength": 128,
          "pattern": "^[A-Za-z0-9][A-Za-z0-9_.:/-]*$"
        },
        "width": {
          "anyOf": [
            {
              "type": "string",
              "minLength": 1,
              "maxLength": 128,
              "pattern": "^[A-Za-z0-9][A-Za-z0-9_.:/-]*$"
            },
            {
              "type": "null"
            }
          ]
        },
        "depth": {
          "anyOf": [
            {
              "type": "string",
              "minLength": 1,
              "maxLength": 128,
              "pattern": "^[A-Za-z0-9][A-Za-z0-9_.:/-]*$"
            },
            {
              "type": "null"
            }
          ]
        }
      },
      "required": [
        "identity"
      ],
      "additionalProperties": false
    },
    "item": {
      "type": "object",
      "properties": {
        "identity": {
          "type": "string",
          "minLength": 1,
          "maxLength": 128,
          "pattern": "^[A-Za-z0-9][A-Za-z0-9_.:/-]*$"
        },
        "width": {
          "anyOf": [
            {
              "type": "string",
              "minLength": 1,
              "maxLength": 128,
              "pattern": "^[A-Za-z0-9][A-Za-z0-9_.:/-]*$"
            },
            {
              "type": "null"
            }
          ]
        },
        "depth": {
          "anyOf": [
            {
              "type": "string",
              "minLength": 1,
              "maxLength": 128,
              "pattern": "^[A-Za-z0-9][A-Za-z0-9_.:/-]*$"
            },
            {
              "type": "null"
            }
          ]
        },
        "rotation": {
          "anyOf": [
            {
              "type": "string",
              "minLength": 1,
              "maxLength": 128,
              "pattern": "^[A-Za-z0-9][A-Za-z0-9_.:/-]*$"
            },
            {
              "type": "null"
            }
          ]
        },
        "position": {
          "type": "object",
          "properties": {
            "x": {
              "anyOf": [
                {
                  "type": "string",
                  "minLength": 1,
                  "maxLength": 128,
                  "pattern": "^[A-Za-z0-9][A-Za-z0-9_.:/-]*$"
                },
                {
                  "type": "null"
                }
              ]
            },
            "y": {
              "anyOf": [
                {
                  "type": "string",
                  "minLength": 1,
                  "maxLength": 128,
                  "pattern": "^[A-Za-z0-9][A-Za-z0-9_.:/-]*$"
                },
                {
                  "type": "null"
                }
              ]
            }
          },
          "required": [],
          "additionalProperties": false
        }
      },
      "required": [
        "identity"
      ],
      "additionalProperties": false
    },
    "openings": {
      "type": "array",
      "items": {
        "type": "object",
        "properties": {
          "id": {
            "type": "string",
            "minLength": 1,
            "maxLength": 128,
            "pattern": "^[A-Za-z0-9][A-Za-z0-9_.:/-]*$"
          },
          "width": {
            "anyOf": [
              {
                "type": "string",
                "minLength": 1,
                "maxLength": 128,
                "pattern": "^[A-Za-z0-9][A-Za-z0-9_.:/-]*$"
              },
              {
                "type": "null"
              }
            ]
          },
          "depth": {
            "anyOf": [
              {
                "type": "string",
                "minLength": 1,
                "maxLength": 128,
                "pattern": "^[A-Za-z0-9][A-Za-z0-9_.:/-]*$"
              },
              {
                "type": "null"
              }
            ]
          },
          "position": {
            "type": "object",
            "properties": {
              "x": {
                "anyOf": [
                  {
                    "type": "string",
                    "minLength": 1,
                    "maxLength": 128,
                    "pattern": "^[A-Za-z0-9][A-Za-z0-9_.:/-]*$"
                  },
                  {
                    "type": "null"
                  }
                ]
              },
              "y": {
                "anyOf": [
                  {
                    "type": "string",
                    "minLength": 1,
                    "maxLength": 128,
                    "pattern": "^[A-Za-z0-9][A-Za-z0-9_.:/-]*$"
                  },
                  {
                    "type": "null"
                  }
                ]
              }
            },
            "required": [],
            "additionalProperties": false
          }
        },
        "required": [
          "id"
        ],
        "additionalProperties": false
      },
      "maxItems": 100
    },
    "explicit_exclusions": {
      "type": "array",
      "items": {
        "type": "object",
        "properties": {
          "id": {
            "type": "string",
            "minLength": 1,
            "maxLength": 128,
            "pattern": "^[A-Za-z0-9][A-Za-z0-9_.:/-]*$"
          },
          "width": {
            "anyOf": [
              {
                "type": "string",
                "minLength": 1,
                "maxLength": 128,
                "pattern": "^[A-Za-z0-9][A-Za-z0-9_.:/-]*$"
              },
              {
                "type": "null"
              }
            ]
          },
          "depth": {
            "anyOf": [
              {
                "type": "string",
                "minLength": 1,
                "maxLength": 128,
                "pattern": "^[A-Za-z0-9][A-Za-z0-9_.:/-]*$"
              },
              {
                "type": "null"
              }
            ]
          },
          "position": {
            "type": "object",
            "properties": {
              "x": {
                "anyOf": [
                  {
                    "type": "string",
                    "minLength": 1,
                    "maxLength": 128,
                    "pattern": "^[A-Za-z0-9][A-Za-z0-9_.:/-]*$"
                  },
                  {
                    "type": "null"
                  }
                ]
              },
              "y": {
                "anyOf": [
                  {
                    "type": "string",
                    "minLength": 1,
                    "maxLength": 128,
                    "pattern": "^[A-Za-z0-9][A-Za-z0-9_.:/-]*$"
                  },
                  {
                    "type": "null"
                  }
                ]
              }
            },
            "required": [],
            "additionalProperties": false
          }
        },
        "required": [
          "id"
        ],
        "additionalProperties": false
      },
      "maxItems": 100
    },
    "required_clearances": {
      "type": "array",
      "items": {
        "type": "object",
        "properties": {
          "id": {
            "type": "string",
            "minLength": 1,
            "maxLength": 128,
            "pattern": "^[A-Za-z0-9][A-Za-z0-9_.:/-]*$"
          },
          "side": {
            "enum": [
              "left",
              "right",
              "top",
              "bottom"
            ]
          },
          "required": {
            "anyOf": [
              {
                "type": "string",
                "minLength": 1,
                "maxLength": 128,
                "pattern": "^[A-Za-z0-9][A-Za-z0-9_.:/-]*$"
              },
              {
                "type": "null"
              }
            ]
          }
        },
        "required": [
          "id",
          "side"
        ],
        "additionalProperties": false
      },
      "maxItems": 100
    }
  },
  "required": [
    "schema_version",
    "case_id",
    "revision",
    "room",
    "item"
  ],
  "additionalProperties": false
}
